{
  "schema_version": "1.0.0",
  "artifact_id": "VAIXLNS.OMEGA_SYMBOL_FABRIC.V1",
  "status": "PROPOSAL",
  "canonical_authority": "VAIXLNS",
  "orchestrator": "VX",
  "assurance_gate": "ARC-X",
  "unicode": {
    "standard": "UTS #51",
    "emoji_version": "18.0",
    "source_policy": "PINNED_VERSIONED_DATA_ONLY",
    "chart_reference": "https://unicode.org/emoji/charts/full-emoji-list.html",
    "normative_data_directory": "https://www.unicode.org/Public/UCD/latest/emoji/",
    "normative_test_file": "https://www.unicode.org/Public/UCD/latest/emoji/emoji-test.txt",
    "expected_sha256": null,
    "version_observed_on": "2026-10-25",
    "runtime_network_access": false,
    "source_file_must_be_supplied_locally": true
  },
  "policy": {
    "default_mode": "READ_ONLY",
    "unknown_sequence_action": "HOLD_UNKNOWN_SEQUENCE",
    "version_mismatch_action": "HOLD_VERSION_MISMATCH",
    "missing_data_action": "HOLD_DATA_NOT_MOUNTED",
    "semantic_label_is_authority": false,
    "rendering_is_evidence_of_support": false,
    "execute_source_code": false,
    "network_access": false,
    "canonical_mutation": false,
    "source_deletion": false,
    "preserve_original_derived_superseded_active_lineage": true
  },
  "input_contract": {
    "format": "Unicode emoji-test.txt",
    "encoding": "UTF-8",
    "maximum_bytes": 2097152,
    "maximum_records": 100000,
    "statuses": [
      "fully-qualified",
      "minimally-qualified",
      "unqualified",
      "component"
    ],
    "preserve_exact_codepoint_sequence": true,
    "normalize_source_sequences": false,
    "duplicate_sequence_action": "HOLD_DUPLICATE_SEQUENCE"
  },
  "output_contract": {
    "format": "deterministic-json",
    "artifact_type": "Ω-SYMBOL-IR",
    "proof_level": "SOURCE_HASH_AND_DATASET_MEMBERSHIP_ONLY",
    "include_source_sha256": true,
    "include_source_version": true,
    "include_line_numbers": true,
    "semantic_state": "NOT_CONFIGURED",
    "compiler_state": "NOT_CONFIGURED",
    "execution_state": "NOT_EXECUTED",
    "canonical_admission_state": "NOT_REQUESTED"
  },
  "offices": [
    {
      "office_id": "Ω.SYMBOL",
      "roles": [
        "VX-ENG-LANG",
        "VX-ENG-ARCH",
        "VX-ENG-INNOV",
        "VX-ENG-TEST",
        "VX-ENG-PROOF",
        "MIND-PROOF"
      ],
      "scope": "versioned Unicode symbol inventory, sequence validation, cross-language design and reproducibility evidence"
    }
  ],
  "target_languages": [
    {
      "language_id": "NXL-S",
      "candidate_role": "surface_symbol_literal",
      "grammar_state": "NOT_MOUNTED",
      "semantic_state": "NOT_CONFIGURED",
      "compiler_state": "NOT_CONFIGURED",
      "status": "PROPOSAL"
    },
    {
      "language_id": "NXL-SYS",
      "candidate_role": "system_symbol_identity_and_registry",
      "grammar_state": "NOT_MOUNTED",
      "semantic_state": "NOT_CONFIGURED",
      "compiler_state": "NOT_CONFIGURED",
      "status": "PROPOSAL"
    },
    {
      "language_id": "NXL-ARCH",
      "candidate_role": "stage_and_component_boundaries",
      "grammar_state": "NOT_MOUNTED",
      "semantic_state": "NOT_CONFIGURED",
      "compiler_state": "NOT_CONFIGURED",
      "status": "PROPOSAL"
    },
    {
      "language_id": "NXL-CON",
      "candidate_role": "input_and_policy_contracts",
      "grammar_state": "NOT_MOUNTED",
      "semantic_state": "NOT_CONFIGURED",
      "compiler_state": "NOT_CONFIGURED",
      "status": "PROPOSAL"
    },
    {
      "language_id": "NXL-PROOF",
      "candidate_role": "provenance_and_conformance_claims",
      "grammar_state": "NOT_MOUNTED",
      "semantic_state": "NOT_CONFIGURED",
      "compiler_state": "NOT_CONFIGURED",
      "status": "PROPOSAL"
    },
    {
      "language_id": "NXL-EXEC",
      "candidate_role": "runtime_lookup_contract",
      "grammar_state": "NOT_MOUNTED",
      "semantic_state": "NOT_CONFIGURED",
      "compiler_state": "NOT_CONFIGURED",
      "status": "PROPOSAL"
    },
    {
      "language_id": "NXL-EVO",
      "candidate_role": "append_only_version_diff",
      "grammar_state": "NOT_MOUNTED",
      "semantic_state": "NOT_CONFIGURED",
      "compiler_state": "NOT_CONFIGURED",
      "status": "PROPOSAL"
    },
    {
      "language_id": "NXL-Q",
      "candidate_role": "typed_symbol_search_request",
      "grammar_state": "NOT_MOUNTED",
      "semantic_state": "NOT_CONFIGURED",
      "compiler_state": "NOT_CONFIGURED",
      "status": "PROPOSAL"
    },
    {
      "language_id": "NXL-VIS",
      "candidate_role": "rendering_and_fallback_contract",
      "grammar_state": "NOT_MOUNTED",
      "semantic_state": "NOT_CONFIGURED",
      "compiler_state": "NOT_CONFIGURED",
      "status": "PROPOSAL"
    }
  ]
}
